{
 "schema": "kleinhirn-device-result/1",
 "createdAt": "2026-09-30T10:35:24.187Z",
 "page": {
  "url": "https://smashburger-dev.github.io/kleinhirn/",
  "buildId": "munat6gw",
  "engineCommit": "e9dcb26",
  "engineBuildId": "munat69a",
  "bundleSha256": "10c685f9e617f6e1a6dc56e9c1157841826248e6f3a976ac87a4e402e53c0f2b",
  "workerSha256": "22c40545256975c7f795162cacbd6c6e31f3826960442eedb8956830c7893dba"
 },
 "weights": {
  "base": "https://huggingface.co/smashburger-dev/kleinhirn-weights/resolve/f664c7a5ad15c81f1258e72c8f90925b64711d1d/small-upstream/",
  "stages": {
   "f16": {
    "manifestSha256": "55ec9de9a8adf1b814d966b6402733b32ca3adfb2bd72bcbf52e2af8a567e632",
    "shards": [
     {
      "file": "weights-0.bin",
      "bytes": 92160000,
      "sha256": "46ac9b4bf9643d1dbba27f7a98ac7faadd5ea60d9044b87be7c03aa32c227f16"
     },
     {
      "file": "weights-1.bin",
      "bytes": 59164418,
      "sha256": "5b6d81079c7ca547851c9f58ad4cff7c74f072df402b196eed8d05ef5973e1a7"
     }
    ],
    "tokenizerBytes": 8341713,
    "error": null
   },
   "f32": {
    "manifestSha256": "94bf16498ad58d2cab48f9a4d952a296e704f1568a610a06a9e45a263ca7c881",
    "shards": [
     {
      "file": "weights-0.bin",
      "bytes": 92160000,
      "sha256": "96c788eb94f34347639a4cafea9fbd1780a9ba2848ef69feef1bcb26ffde47b2"
     },
     {
      "file": "weights-1.bin",
      "bytes": 92160000,
      "sha256": "65a3cf781bc409f8c2a881911789dc02535a9298dc719f682285b770c34bc7d6"
     },
     {
      "file": "weights-2.bin",
      "bytes": 93499392,
      "sha256": "aeda8509c05bdb89df356a09b88903cc3cbd9a61a6a00e78a039dd8e6b38eac8"
     },
     {
      "file": "weights-3.bin",
      "bytes": 24829444,
      "sha256": "70fc5ed9f56c50911cf578e06eaf7a89abec64c5ca4e9627907c105d0c180698"
     }
    ],
    "tokenizerBytes": 8341713,
    "error": null
   }
  }
 },
 "goldens": {
  "sha256": "a97f4d0cd3d9f4546ac6bd1e282ab9ffdc30c9ae9e6167cf1383800bcabd24fb",
  "model": "small-upstream",
  "buckets": [
   "L128",
   "L256"
  ],
  "sourceSha256": {
   "texts1000_l128k16.json": "4234e34db61fff36b7d121f7614910ae07f78c6e95f577997953bd7e3bc5509c",
   "long200_l256k16.json": "d3982b87b7afd1b8943eba4139f233fcc79beee4ee51693d61bc662b06c109f9"
  }
 },
 "device": {
  "model": "iPhone 16 Pro 256GB",
  "os": "iOS 27.0 (24A437)",
  "protocol": {
   "pluggedIn": false,
   "screenOn": false,
   "lowPowerModeOff": false,
   "otherTabsClosed": false
  }
 },
 "environment": {
  "userAgent": "Mozilla/5.0 (iPhone; CPU iPhone OS 18_7 like Mac OS X) AppleWebKit/605.1.15 (KHTML, like Gecko) Version/27.0 Mobile/15E148 Safari/604.1",
  "userAgentData": null,
  "hardwareConcurrency": 4,
  "deviceMemory": null,
  "maxTouchPoints": 5,
  "isSecureContext": true,
  "crossOriginIsolated": false,
  "wasmSimd": true,
  "workerHardwareConcurrency": 4,
  "float16Array": "function",
  "opfs": true,
  "storagePersisted": false,
  "storageQuotaBytes": 41231686042,
  "webgpu": {
   "present": true,
   "adapter": {
    "info": {
     "vendor": "apple",
     "architecture": "apple",
     "device": "apple",
     "description": "apple",
     "subgroupMinSize": null,
     "subgroupMaxSize": null,
     "isFallbackAdapter": false
    },
    "features": [
     "bgra8unorm-storage",
     "clip-distances",
     "core-features-and-limits",
     "depth-clip-control",
     "depth32float-stencil8",
     "float16-renderable",
     "float32-blendable",
     "float32-filterable",
     "float32-renderable",
     "indirect-first-instance",
     "primitive-index",
     "rg11b10ufloat-renderable",
     "shader-f16",
     "texture-compression-astc",
     "texture-compression-astc-sliced-3d",
     "texture-compression-bc",
     "texture-compression-bc-sliced-3d",
     "texture-compression-etc2",
     "texture-formats-tier1",
     "texture-formats-tier2",
     "timestamp-query"
    ],
    "limits": {
     "maxTextureDimension1D": 16384,
     "maxTextureDimension2D": 16384,
     "maxTextureDimension3D": 2048,
     "maxTextureArrayLayers": 2048,
     "maxBindGroups": 11,
     "maxBindGroupsPlusVertexBuffers": 30,
     "maxBindingsPerBindGroup": 65535,
     "maxDynamicUniformBuffersPerPipelineLayout": 65535,
     "maxDynamicStorageBuffersPerPipelineLayout": 65535,
     "maxSampledTexturesPerShaderStage": 44,
     "maxSamplersPerShaderStage": 22,
     "maxStorageBuffersPerShaderStage": 44,
     "maxStorageTexturesPerShaderStage": 44,
     "maxUniformBuffersPerShaderStage": 44,
     "maxUniformBufferBindingSize": 1073741824,
     "maxStorageBufferBindingSize": 1073741824,
     "minUniformBufferOffsetAlignment": 32,
     "minStorageBufferOffsetAlignment": 32,
     "maxVertexBuffers": 12,
     "maxBufferSize": 1073741824,
     "maxVertexAttributes": 30,
     "maxVertexBufferArrayStride": 65532,
     "maxInterStageShaderVariables": 31,
     "maxColorAttachments": 8,
     "maxColorAttachmentBytesPerSample": 64,
     "maxComputeWorkgroupStorageSize": 32768,
     "maxComputeInvocationsPerWorkgroup": 1024,
     "maxComputeWorkgroupSizeX": 1024,
     "maxComputeWorkgroupSizeY": 1024,
     "maxComputeWorkgroupSizeZ": 1024,
     "maxComputeWorkgroupsPerDimension": 65535,
     "maxStorageBuffersInVertexStage": 44,
     "maxStorageBuffersInFragmentStage": 44,
     "maxStorageTexturesInVertexStage": 44,
     "maxStorageTexturesInFragmentStage": 44
    }
   },
   "error": null
  },
  "rangeProbe": {
   "url": "https://huggingface.co/smashburger-dev/kleinhirn-weights/resolve/f664c7a5ad15c81f1258e72c8f90925b64711d1d/small-upstream/f32/weights-0.bin",
   "status": 206,
   "bytesReceived": 1024,
   "contentRange": "bytes 0-1023/92160000",
   "error": null
  },
  "storageMarker": {
   "checkedAt": "2026-09-30T10:33:28.051Z",
   "opfs": {
    "present": false,
    "firstSeen": null,
    "lastSeen": null,
    "visits": null,
    "ageDays": null,
    "readError": null,
    "writeError": null
   },
   "cache": {
    "present": false,
    "firstSeen": null,
    "lastSeen": null,
    "visits": null,
    "ageDays": null,
    "readError": null,
    "writeError": null
   },
   "localStorage": {
    "present": false,
    "firstSeen": null,
    "lastSeen": null,
    "visits": null,
    "ageDays": null,
    "readError": null,
    "writeError": null
   }
  }
 },
 "autoStage": {
  "picked": "f16",
  "manifest": "https://huggingface.co/smashburger-dev/kleinhirn-weights/resolve/f664c7a5ad15c81f1258e72c8f90925b64711d1d/small-upstream/f16/manifest.json",
  "error": null,
  "reusedAsMeasured": true
 },
 "stages": [
  {
   "name": "f16",
   "ok": true,
   "error": null,
   "errorPhase": null,
   "parityPass": true,
   "gateRule": "f16",
   "load": {
    "wallMs": 17045,
    "loadTiming": {
     "fetchMs": 16567,
     "bodyMs": 28888,
     "sha256Ms": 124,
     "uploadMs": 22,
     "embedJoinMs": 16,
     "manifestMs": 158,
     "tokenizerMs": 85,
     "planMs": 4
    },
    "backend": "webgpu",
    "precision": "f16",
    "hasF16": true,
    "limitsMode": "minimum",
    "gpuBytes": 57249484,
    "downloadBytes": 159686872,
    "engineBuildId": "munat69a"
   },
   "parity": {
    "L128": {
     "summary": {
      "n": 200,
      "argmaxAgreement": 1,
      "maxAbsLogitDiff": 0.013699531555175781,
      "meanAbsLogitDiff": 0.0023989477207267975,
      "maxAbsProbDiff": 0.004070762905913794,
      "disagreements": []
     },
     "pass": true,
     "missing": 0,
     "perCaseLogits": [
      [
       -1.09668,
       -2.85938,
       -0.185425,
       -3.41992,
       -0.642578,
       -3.19141,
       -2.91797,
       -3.08398,
       -2.40039,
       -2.35156
      ],
      [
       0.210083,
       -4.19531,
       -3.35938,
       -0.538574,
       -2.49023,
       -3.81836,
       -3.89844,
       -4.07422,
       -3.73633,
       -1.63477
      ],
      [
       2.48047,
       -5.81641,
       -5.59375,
       -1.66602,
       -3.31641,
       -5.95703,
       -1.08691,
       -4.82813,
       -3.90039,
       -2.79492
      ],
      [
       -0.787109,
       -3.48633,
       -2.65625,
       -2.9668,
       -2.23438,
       -2.41992,
       -2.17578,
       -3.17969,
       -2.48242,
       -2.3125
      ],
      [
       -1.28613,
       -2.90625,
       -2.48828,
       -1.54883,
       -0.4104,
       -3.74219,
       -2.89063,
       -2.96484,
       -3.51367,
       -1.17871
      ],
      [
       -0.876465,
       -1.61816,
       -3.11719,
       -1.33594,
       -1.77441,
       -3.23047,
       -1.51367,
       -2.27539,
       -2.49023,
       -1.96387
      ],
      [
       -0.579102,
       -1.4082,
       -2.27539,
       -1.09375,
       -1.21484,
       -2.47852,
       -1.89648,
       -1.50488,
       -1.58887,
       -1.60156
      ],
      [
       -0.83252,
       -3.67969,
       -3.01953,
       -3.00977,
       -2.59375,
       -1.36035,
       -2.51367,
       0.402344,
       -2.17773,
       -2.62891
      ],
      [
       -0.618164,
       -3.89648,
       0.0969238,
       -2.51172,
       -2.64453,
       -2.73242,
       -2.69141,
       -2.73828,
       -3.05859,
       -1.18945
      ],
      [
       0.759766,
       -5.05078,
       -5.58203,
       0.0272827,
       -2.9043,
       -5.46484,
       -4.07813,
       -4.48438,
       -3.94336,
       -2.54492
      ],
      [
       -1.29199,
       -5.33984,
       -5.46875,
       -4.29297,
       -4.16406,
       -6.16016,
       -5.48438,
       1.91211,
       -5.36328,
       -4.52734
      ],
      [
       -0.28418,
       -1.92676,
       -3.20313,
       -1.63574,
       -0.802734,
       -3.38281,
       -1.16504,
       -2.16406,
       -2.43555,
       -2.63867
      ],
      [
       0.975586,
       -2.39063,
       -2.95117,
       -0.221069,
       -2.33789,
       -2.8418,
       -1.29199,
       -2.90625,
       -1.85352,
       -1.22363
      ],
      [
       0.199219,
       -2.62891,
       -2.39453,
       -1.56543,
       -1.21191,
       -2.23438,
       -2.23047,
       -2.41406,
       -2.62109,
       -1.63965
      ],
      [